question,answer
What is the meaning of the phrase "put all your eggs in one basket"?,"Put all your eggs in one basket" means to invest all your resources or efforts into a single venture, risking everything on its success.
Can you recommend a good romance movie?,Certainly! What style of romance movie are you interested in? Romantic comedy, drama, or classic romance?
How do I start a podcast for interviews?,Starting an interview podcast involves reaching out to guests, preparing questions, and refining your interviewing skills. What topics or guests are you interested in?
What is the meaning of the phrase "rub someone the wrong way"?,"Rub someone the wrong way" means to irritate or annoy someone with your behavior or actions.
Can you recommend a good language learning app?,Of course! What language are you interested in learning, and what features are you looking for in a language learning app?
How do I stay creative during a creative block?,Staying creative during a block involves trying new activities, seeking inspiration, and giving yourself time and space. What creative pursuits interest you?
What is the meaning of the phrase "run a tight ship"?,"Run a tight ship" means to manage something efficiently and with strict control.
Can you recommend a good documentary on space?,Certainly! What specific aspects of space are you interested in? Planets, black holes, or space exploration?
How do I start a podcast for music?,Starting a music podcast involves selecting genres, curating playlists, and engaging with listeners. What type of music do you want to feature?
What is the meaning of the phrase "shake a leg"?,"Shake a leg" is an informal expression that means to hurry up or get moving.
Can you recommend a good mystery podcast?,Of course! What type of mystery are you interested in? True crime, fictional mysteries, or historical mysteries?
How do I start a mindfulness meditation practice?,Starting a mindfulness meditation practice involves finding a quiet space, focusing on the present moment, and practicing regularly. What are your goals with mindfulness?
What is the meaning of the phrase "shoot the breeze"?,"Shoot the breeze" is a casual expression that means to have a relaxed and informal conversation.
Can you recommend a good comedy TV show?,Certainly! What style of comedy TV show are you interested in? Sitcom, sketch comedy, or dark humor?
How do I start a podcast for technology?,Starting a technology podcast involves staying updated on tech trends, interviewing experts, and engaging with your audience. What tech topics are you passionate about?
What is the meaning of the phrase "skeleton in the closet"?,"Skeleton in the closet" refers to a hidden or undisclosed shameful secret from the past.
Can you recommend a good educational YouTube channel?,Of course! What subjects or topics are you interested in learning more about? I can suggest educational channels based on your preferences.
How do I stay motivated to achieve long-term goals?,Staying motivated for long-term goals involves breaking them into smaller milestones, tracking progress, and celebrating achievements. What long-term goals are you working towards?
What is the meaning of the phrase "spill the beans"?,"Spill the beans" means to disclose a secret or reveal confidential information.
Can you recommend a good indie music band?,Certainly! What style of indie music are you interested in? Indie rock, indie pop, or indie folk?
How do I start a podcast for personal development?,Starting a personal development podcast involves sharing insights, interviewing experts, and engaging with your audience. What personal development topics are you passionate about?
What is the meaning of the phrase "stab someone in the back"?,"Stab someone in the back" means to betray or deceive someone, usually by breaking a trust or friendship.
Can you recommend a good animated movie?,Of course! What style of animated movie are you interested in? Disney, Pixar, anime, or something else?
How do I stay organized with digital tools?,Staying organized with digital tools involves using calendars, task management apps, and cloud storage. What specific tools are you currently using?
What is the meaning of the phrase "step up to the plate"?,"Step up to the plate" means to take responsibility or rise to a challenge.
Can you recommend a good self-help podcast?,Certainly! What specific area of self-help are you looking to explore? Motivation, mindfulness, or personal growth?
How do I start a podcast for business tips?,Starting a business tips podcast involves sharing insights, interviewing experts, and engaging with your audience. What business topics are you passionate about?
What is the meaning of the phrase "sweat bullets"?,"Sweat bullets" means to be very nervous or anxious, often in anticipation of a challenging situation.
Can you recommend a good documentary on wildlife?,Of course! What specific aspects of wildlife are you interested in? Animal behavior, conservation, or ecosystems?
How do I stay focused on my studies?,Staying focused on studies involves creating a conducive environment, minimizing distractions, and practicing effective study techniques. What subjects are you studying?
What is the meaning of the phrase "take a rain check"?,"Take a rain check" means to decline an invitation or offer but express the intention to accept it at a later time.
Can you recommend a good fantasy board game?,Certainly! What player count and style of fantasy board game are you interested in?
How do I start a podcast for travel adventures?,Starting a travel adventures podcast involves sharing experiences, interviewing travelers, and engaging with your audience. What travel adventures are you passionate about?
What is the meaning of the phrase "throw in the towel"?,"Throw in the towel" means to give up or surrender in the face of a challenge.
Can you recommend a good mobile RPG game?,Of course! What platform and style of RPG game are you interested in? Mobile, action RPG, or turn-based?
How do I stay positive in a negative world?,Staying positive in a negative world involves focusing on the good, practicing gratitude, and seeking joy in small moments. What specific challenges are you facing?
What is the meaning of the phrase "turn over a new leaf"?,"Turn over a new leaf" means to make a fresh start or change one's behavior for the better.
Can you recommend a good historical documentary?,Certainly! What specific historical period or events are you interested in? I can suggest documentaries based on your preferences.
How do I start a podcast for book reviews?,Starting a book reviews podcast involves sharing insights, interviewing authors, and engaging with your audience. What genres of books do you want to review?
What is the meaning of the phrase "under the weather"?,"Under the weather" means feeling unwell or not in good health.
Can you recommend a good puzzle-solving game?,Of course! What platform and style of puzzle-solving game are you interested in? PC, console, mystery, or adventure?
How do I stay productive while working remotely?,Staying productive while working remotely involves creating a dedicated workspace, setting a schedule, and minimizing distractions. What specific challenges are you facing?
What is the meaning of the phrase "wear your heart on your sleeve"?,"Wear your heart on your sleeve" means to openly display or express one's emotions.
Can you recommend a good documentary on science and technology?,Certainly! What specific aspects of science and technology are you interested in? I can suggest documentaries based on your preferences.
How do I start a podcast for fitness and wellness?,Starting a fitness and wellness podcast involves sharing tips, interviewing experts, and engaging with your audience. What fitness and wellness topics are you passionate about?
What is the meaning of the phrase "you can't have your cake and eat it too"?,"You can't have your cake and eat it too" means you can't enjoy the benefits of something while still preserving it.
Can you recommend a good science fiction board game?,Of course! What player count and style of science fiction board game are you interested in?
How do I stay motivated to learn a new skill?,Staying motivated to learn a new skill involves setting realistic goals, celebrating progress, and finding enjoyment in the learning process. What skill are you looking to learn?
What is the meaning of the phrase "zero in on"?,"Zero in on" means to focus or direct attention precisely on a specific target or objective.
Can you recommend a good comedy mobile game?,Certainly! What platform and style of comedy mobile game are you interested in?
How do I start a podcast for mental health?,Starting a mental health podcast involves sharing insights, interviewing professionals, and providing resources. What mental health topics are you passionate about?
What is the meaning of the phrase "zip your lip"?,"Zip your lip" means to remain silent or stop talking.
Can you recommend a good animated TV show?,Of course! What style of animated TV show are you interested in? Cartoon, anime, or adult animation?
How do I stay focused on my goals?,Staying focused on goals involves setting priorities, breaking them into manageable tasks, and regularly reassessing progress. What specific goals are you working towards?
What is the meaning of the phrase "all ears"?,"All ears" means to be fully attentive or ready to listen.
Can you recommend a good mobile strategy game?,Certainly! What platform and style of mobile strategy game are you interested in?
How do I stay positive during tough times?,Staying positive during tough times involves finding silver linings, seeking support, and focusing on what you can control. What specific challenges are you facing?
What is the meaning of the phrase "back to the drawing board"?,"Back to the drawing board" means to start over or reconsider a plan after it has failed.
Can you recommend a good documentary on art and creativity?,Of course! What specific aspects of art and creativity are you interested in? I can suggest documentaries based on your preferences.
How do I start a podcast for gaming reviews?,Starting a gaming reviews podcast involves sharing insights, interviewing developers, and engaging with your audience. What genres of games do you want to review?
What is the meaning of the phrase "burn the midnight oil"?,"Burn the midnight oil" means to work late into the night or early morning hours.
Can you recommend a good fantasy mobile game?,Certainly! What platform and style of fantasy mobile game are you interested in?
How do I stay organized with paper clutter?,Staying organized with paper clutter involves creating a filing system, regularly decluttering, and digitizing important documents. What specific challenges are you facing?
What is the meaning of the phrase "clean as a whistle"?,"Clean as a whistle" means very clean or pure, often used to describe a neat and tidy appearance.
Can you recommend a good science fiction RPG game?,Of course! What platform and style of science fiction RPG game are you interested in?
How do I stay positive at work?,Staying positive at work involves focusing on accomplishments, maintaining a positive mindset, and fostering a supportive work environment. What specific challenges are you facing?
What is the meaning of the phrase "bite the bullet"?,"Bite the bullet" means to endure a painful or difficult situation with courage and resilience.
Can you recommend a good mystery mobile game?,Certainly! What platform and style of mystery mobile game are you interested in?
How do I stay motivated to write?,Staying motivated to write involves setting goals, creating a routine, and finding inspiration. What type of writing are you working on?
What is the meaning of the phrase "dead as a doornail"?,"Dead as a doornail" means completely lifeless or inert.
Can you recommend a good puzzle mobile game?,Of course! What platform and style of puzzle mobile game are you interested in?
How do I stay focused while reading?,Staying focused while reading involves minimizing distractions, setting a comfortable environment, and taking breaks. What type of reading material are you interested in?
What is the meaning of the phrase "fall on deaf ears"?,"Fall on deaf ears" means that something, such as an appeal or request, is ignored or disregarded by others.
Can you recommend a good romantic mobile game?,Certainly! What platform and style of romantic mobile game are you interested in?
How do I stay positive in a negative relationship?,Staying positive in a negative relationship involves communication, setting boundaries, and considering your well-being. What specific challenges are you facing?
What is the meaning of the phrase "get a taste of your own medicine"?,"Get a taste of your own medicine" means to experience the same negative treatment that one has given to others.
Can you recommend a good action mobile game?,Of course! What platform and style of action mobile game are you interested in?
How do I stay motivated to cook at home?,Staying motivated to cook at home involves planning meals, trying new recipes, and making the cooking process enjoyable. What cuisines or dishes are you interested in?
What is the meaning of the phrase "hit the hay"?,"Hit the hay" is a casual expression for going to bed or getting some sleep.
Can you recommend a good historical mobile game?,Certainly! What platform and style of historical mobile game are you interested in?
How do I stay focused on my passion projects?,Staying focused on passion projects involves setting clear goals, managing time effectively, and staying inspired. What passion projects are you working on?
What is the meaning of the phrase "jump on the bandwagon"?,"Jump on the bandwagon" means to adopt a popular activity or trend.
Can you recommend a good simulation mobile game?,Of course! What platform and style of simulation mobile game are you interested in?
How do I stay positive during a job search?,Staying positive during a job search involves maintaining a routine, seeking support, and focusing on your skills and accomplishments. What specific challenges are you facing?
What is the meaning of the phrase "kick the bucket"?,"Kick the bucket" is a colloquial expression for dying or passing away.
Can you recommend a good strategy mobile game?,Certainly! What platform and style of strategy mobile game are you interested in?
How do I stay organized with digital files?,Staying organized with digital files involves creating a folder structure, using consistent file naming conventions, and regular decluttering. What specific challenges are you facing?
What is the meaning of the phrase "let the cat out of the bag"?,"Let the cat out of the bag" means to reveal a secret or disclose information that was meant to be kept confidential.
Can you recommend a good sports mobile game?,Of course! What platform and style of sports mobile game are you interested in?
How do I stay positive during tough times at school?,Staying positive during tough times at school involves seeking support, focusing on small victories, and practicing self-care. What specific challenges are you facing?
What is the meaning of the phrase "make a long story short"?,"Make a long story short" means to summarize or provide a concise version of a lengthy narrative.
Can you recommend a good word game mobile app?,Certainly! What platform and style of word game mobile app are you interested in?
How do I stay motivated to learn a new language?,Staying motivated to learn a new language involves setting realistic goals, practicing regularly, and making the learning process enjoyable. What language are you learning?
What is the meaning of the phrase "nip it in the bud"?,"Nip it in the bud" means to stop a problem or issue before it becomes more serious.
Can you recommend a good weather app for mobile?,Of course! What features are you looking for in a weather app? Forecast accuracy, radar maps, or severe weather alerts?
How do I stay positive during a job loss?,Staying positive during a job loss involves giving yourself time to grieve, seeking support, and focusing on opportunities for growth. What specific challenges are you facing?
What is the meaning of the phrase "put all your eggs in one basket"?,"Put all your eggs in one basket" means to invest all your resources or efforts into a single venture, risking everything on its success.
Can you recommend a good music streaming app for mobile?,Certainly! What features are you looking for in a music streaming app? Extensive music library, personalized playlists, or offline listening?
How do I stay organized with a busy schedule?,Staying organized with a busy schedule involves prioritizing tasks, using calendars and reminders, and learning to delegate. What specific challenges are you facing?
What is the meaning of the phrase "rub someone the wrong way"?,"Rub someone the wrong way" means to irritate or annoy someone with your behavior or actions.
Can you recommend a good podcast app for mobile?,Of course! What features are you looking for in a podcast app? User-friendly interface, recommendations, or offline listening?
How do I stay positive during a health challenge?,Staying positive during a health challenge involves focusing on what you can control, seeking support, and maintaining a healthy mindset. What specific health challenges are you facing?
What is the meaning of the phrase "shake a leg"?,"Shake a leg" is an informal expression that means to hurry up or get moving.
Can you recommend a good productivity app for mobile?,Certainly! What specific productivity features are you looking for in an app? Task management, goal tracking, or time blocking?
How do I stay motivated to exercise during the winter?,Staying motivated to exercise during the winter involves finding indoor activities, setting realistic goals, and creating a routine. What types of exercise do you enjoy?
What is the meaning of the phrase "shoot the breeze"?,"Shoot the breeze" is a casual expression that means to have a relaxed and informal conversation.
Can you recommend a good meditation app for mobile?,Of course! What features are you looking for in a meditation app? Guided meditations, mindfulness exercises, or sleep aids?
How do I stay positive during a relocation?,Staying positive during a relocation involves exploring the new environment, staying connected with loved ones, and focusing on the opportunities it brings. What specific challenges are you facing?
What is the meaning of the phrase "skeleton in the closet"?,"Skeleton in the closet" refers to a hidden or undisclosed shameful secret from the past.
Can you recommend a good language translation app for mobile?,Certainly! What features are you looking for in a language translation app? Accuracy, multiple language support, or offline capabilities?
How do I stay positive during a creative block?,Staying positive during a creative block involves exploring new sources of inspiration, taking breaks, and being patient with the process. What creative pursuits interest you?
What is the meaning of the phrase "spill the beans"?,"Spill the beans" means to disclose a secret or reveal confidential information.
Can you recommend a good finance app for mobile?,Of course! What specific finance features are you looking for in an app? Budget tracking, investment monitoring, or expense categorization?
How do I stay motivated to achieve long-term goals?,Staying motivated for long-term goals involves breaking them into smaller milestones, tracking progress, and celebrating achievements. What long-term goals are you working towards?
What is the meaning of the phrase "take a rain check"?,"Take a rain check" means to decline an invitation or offer but express the intention to accept it at a later time.
Can you recommend a good travel app for mobile?,Certainly! What features are you looking for in a travel app? Itinerary planning, hotel booking, or local recommendations?
How do I stay positive during a challenging project?,Staying positive during a challenging project involves breaking it into smaller tasks, seeking support, and celebrating milestones. What specific challenges are you facing?
What is the meaning of the phrase "turn over a new leaf"?,"Turn over a new leaf" means to make a fresh start or change one's behavior for the better.
Can you recommend a good photo editing app for mobile?,Of course! What specific photo editing features are you looking for in an app? Filters, cropping tools, or advanced editing options?
How do I stay focused while working remotely?,Staying focused while working remotely involves creating a dedicated workspace, setting a schedule, and minimizing distractions. What specific challenges are you facing?
What is the meaning of the phrase "wear your heart on your sleeve"?,"Wear your heart on your sleeve" means to openly display or express one's emotions.
Can you recommend a good fitness app for mobile?,Certainly! What features are you looking for in a fitness app? Workout routines, progress tracking, or meal planning?
How do I stay positive during a job search?,Staying positive during a job search involves maintaining a routine, seeking support, and focusing on your skills and accomplishments. What specific challenges are you facing?
What is the meaning of the phrase "all ears"?,"All ears" means to be fully attentive or ready to listen.
Can you recommend a good recipe app for mobile?,Of course! What specific recipe features are you looking for in an app? Dietary preferences, step-by-step instructions, or meal planning?
How do I stay positive during tough times at school?,Staying positive during tough times at school involves seeking support, focusing on small victories, and practicing self-care. What specific challenges are you facing?
What is the meaning of the phrase "make a long story short"?,"Make a long story short" means to summarize or provide a concise version of a lengthy narrative.
Can you recommend a good language learning app for mobile?,Certainly! What language are you interested in learning, and what features are you looking for in a language learning app?
How do I stay motivated to learn a new skill?,Staying motivated to learn a new skill involves setting realistic goals, celebrating progress, and finding enjoyment in the learning process. What skill are you looking to learn?
What is the meaning of the phrase "zero in on"?,"Zero in on" means to focus or direct attention precisely on a specific target or objective.
Can you recommend a good music streaming app for mobile?,Certainly! What features are you looking for in a music streaming app? Extensive music library, personalized playlists, or offline listening?
How do I stay organized with a busy schedule?,Staying organized with a busy schedule involves prioritizing tasks, using calendars and reminders, and learning to delegate. What specific challenges are you facing?
What is the meaning of the phrase "rub someone the wrong way"?,"Rub someone the wrong way" means to irritate or annoy someone with your behavior or actions.
Can you recommend a good podcast app for mobile?,Of course! What features are you looking for in a podcast app? User-friendly interface, recommendations, or offline listening?
How do I stay positive during a health challenge?,Staying positive during a health challenge involves focusing on what you can control, seeking support, and maintaining a healthy mindset. What specific health challenges are you facing?
What is the meaning of the phrase "shake a leg"?,"Shake a leg" is an informal expression that means to hurry up or get moving.
Can you recommend a good productivity app for mobile?,Certainly! What specific productivity features are you looking for in an app? Task management, goal tracking, or time blocking?
How do I stay motivated to exercise during the winter?,Staying motivated to exercise during the winter involves finding indoor activities, setting realistic goals, and creating a routine. What types of exercise do you enjoy?
What is the meaning of the phrase "shoot the breeze"?,"Shoot the breeze" is a casual expression that means to have a relaxed and informal conversation.
Can you recommend a good meditation app for mobile?,Of course! What features are you looking for in a meditation app? Guided meditations, mindfulness exercises, or sleep aids?
How do I stay positive during a relocation?,Staying positive during a relocation involves exploring the new environment, staying connected with loved ones, and focusing on the opportunities it brings. What specific challenges are you facing?
What is the meaning of the phrase "skeleton in the closet"?,"Skeleton in the closet" refers to a hidden or undisclosed shameful secret from the past.
Can you recommend a good language translation app for mobile?,Certainly! What features are you looking for in a language translation app? Accuracy, multiple language support, or offline capabilities?
How do I stay positive during a creative block?,Staying positive during a creative block involves exploring new sources of inspiration, taking breaks, and being patient with the process. What creative pursuits interest you?
What is the meaning of the phrase "spill the beans"?,"Spill the beans" means to disclose a secret or reveal confidential information.
Can you recommend a good finance app for mobile?,Of course! What specific finance features are you looking for in an app? Budget tracking, investment monitoring, or expense categorization?
How do I stay motivated to achieve long-term goals?,Staying motivated for long-term goals involves breaking them into smaller milestones, tracking progress, and celebrating achievements. What long-term goals are you working towards?
What is the meaning of the phrase "take a rain check"?,"Take a rain check" means to decline an invitation or offer but express the intention to accept it at a later time.
