question,answer
Can you recommend a good recipe app for mobile?,Of course! What specific recipe features are you looking for in an app? Dietary preferences, step-by-step instructions, or meal planning?
How do I stay positive during tough times at school?,Staying positive during tough times at school involves seeking support, focusing on small victories, and practicing self-care. What specific challenges are you facing?
What is the meaning of the phrase "make a long story short"?,"Make a long story short" means to summarize or provide a concise version of a lengthy narrative.
Can you recommend a good language learning app for mobile?,Certainly! What language are you interested in learning, and what features are you looking for in a language learning app?
How do I stay motivated to learn a new skill?,Staying motivated to learn a new skill involves setting realistic goals, celebrating progress, and finding enjoyment in the learning process. What skill are you looking to learn?
What is the meaning of the phrase "zero in on"?,"Zero in on" means to focus or direct attention precisely on a specific target or objective.
Can you recommend a good music streaming app for mobile?,Certainly! What features are you looking for in a music streaming app? Extensive music library, personalized playlists, or offline listening?
How do I stay organized with a busy schedule?,Staying organized with a busy schedule involves prioritizing tasks, using calendars and reminders, and learning to delegate. What specific challenges are you facing?
What is the meaning of the phrase "rub someone the wrong way"?,"Rub someone the wrong way" means to irritate or annoy someone with your behavior or actions.
Can you recommend a good podcast app for mobile?,Of course! What features are you looking for in a podcast app? User-friendly interface, recommendations, or offline listening?
How do I stay positive during a health challenge?,Stayingpositive during a health challenge involves focusing on what you can control, seeking support, and maintaining a healthy mindset. What specific health challenges are you facing?
What is the meaning of the phrase "shake a leg"?,"Shake a leg" is an informal expression that means to hurry up or get moving.
Can you recommend a good productivity app for mobile?,Certainly! What specific productivity features are you looking for in an app? Task management, goal tracking, or time blocking?
How do I stay motivated to exercise during the winter?,Staying motivated to exercise during the winter involves finding indoor activities, setting realistic goals, and creating a routine. What types of exercise do you enjoy?
What is the meaning of the phrase "shoot the breeze"?,"Shoot the breeze" is a casual expression that means to have a relaxed and informal conversation.
Can you recommend a good meditation app for mobile?,Of course! What features are you looking for in a meditation app? Guided meditations, mindfulness exercises, or sleep aids?
How do I stay positive during a relocation?,Staying positive during a relocation involves exploring the new environment, staying connected with loved ones, and focusing on the opportunities it brings. What specific challenges are you facing?
What is the meaning of the phrase "skeleton in the closet"?,"Skeleton in the closet" refers to a hidden or undisclosed shameful secret from the past.
Can you recommend a good language translation app for mobile?,Certainly! What features are you looking for in a language translation app? Accuracy, multiple language support, or offline capabilities?
How do I stay positive during a creative block?,Staying positive during a creative block involves exploring new sources of inspiration, taking breaks, and being patient with the process. What creative pursuits interest you?
What is the meaning of the phrase "spill the beans"?,"Spill the beans" means to disclose a secret or reveal confidential information.
Can you recommend a good finance app for mobile?,Of course! What specific finance features are you looking for in an app? Budget tracking, investment monitoring, or expense categorization?
How do I stay motivated to achieve long-term goals?,Staying motivated for long-term goals involves breaking them into smaller milestones, tracking progress, and celebrating achievements. What long-term goals are you working towards?
What is the meaning of the phrase "take a rain check"?,"Take a rain check" means to decline an invitation or offer but express the intention to accept it at a later time.
Can you recommend a good travel app for mobile?,Certainly! What features are you looking for in a travel app? Itinerary planning, hotel booking, or local recommendations?
How do I stay positive during a challenging project?,Staying positive during a challenging project involves breaking it into smaller tasks, seeking support, and celebrating milestones. What specific challenges are you facing?
when should i come to college,College is open 8am-5pm Monday-Saturday!
when should i attend college,College is open 8am-5pm Monday-Saturday!
what is my college time,College is open 8am-5pm Monday-Saturday!
list of courses,Our College offers many programs for further details use : http://www.rit.ac.in/courses.php
list of courses offered,Our College offers many programs for further details use : http://www.rit.ac.in/courses.php
list of courses offered in,Our College offers many programs for further details use : http://www.rit.ac.in/courses.php
what are the courses offered in your college?,Our College offers many programs for further details use : http://www.rit.ac.in/courses.php
courses?,Our College offers many programs for further details use : http://www.rit.ac.in/courses.php
courses offered,Our College offers many programs for further details use : http://www.rit.ac.in/courses.php
courses offered in (your univrsity(UNI) name),Our College offers many programs for further details use : http://www.rit.ac.in/courses.php
courses you offer,Our College offers many programs for further details use : http://www.rit.ac.in/courses.php
branches?,Our College offers many programs for further details use : http://www.rit.ac.in/courses.php
courses available at UNI?,Our College offers many programs for further details use : http://www.rit.ac.in/courses.php
branches available at your college?,Our College offers many programs for further details use : http://www.rit.ac.in/courses.php
what are the courses in UNI?,Our College offers many programs for further details use : http://www.rit.ac.in/courses.php
what are branches in UNI?,Our College offers many programs for further details use : http://www.rit.ac.in/courses.php
what are courses in UNI?,Our College offers many programs for further details use : http://www.rit.ac.in/courses.php
branches available in UNI?,Our College offers many programs for further details use : http://www.rit.ac.in/courses.php
can you tell me the courses available in UNI?,Our College offers many programs for further details use : http://www.rit.ac.in/courses.php
can you tell me the branches available in UNI?,Our College offers many programs for further details use : http://www.rit.ac.in/courses.php
computer engineering?,Our College offers many programs for further details use : http://www.rit.ac.in/courses.php
computer,Our College offers many programs for further details use : http://www.rit.ac.in/courses.php
Computer engineering?,Our College offers many programs for further details use : http://www.rit.ac.in/courses.php
it,Our College offers many programs for further details use : http://www.rit.ac.in/courses.php
IT,Our College offers many programs for further details use : http://www.rit.ac.in/courses.php
Information Technology,Our College offers many programs for further details use : http://www.rit.ac.in/courses.php
AI/Ml,Our College offers many programs for further details use : http://www.rit.ac.in/courses.php
Mechanical engineering,Our College offers many programs for further details use : http://www.rit.ac.in/courses.php
Chemical engineering,Our College offers many programs for further details use : http://www.rit.ac.in/courses.php
Civil engineering,Our College offers many programs for further details use : http://www.rit.ac.in/courses.php
what is the name of your developers,College students
what is the name of your creators,College students
what is the name of the developers,College students
what is the name of the creators,College students
who created you,College students
your developers,College students
your creators,College students
who are your developers,College students
developers,College students
you are made by,College students
you are made by whom,College students
who created you,College students
who create you,College students
creators,College students
who made you,College students
who designed you,College students
name,You can call me Mind Reader.,I'm Mind Reader,I am a Chatbot.,I am your helper
timing of college,College is open 8am-5pm Monday-Saturday!
more info,You can contact at: NUMBER
list of courses,Our College offer wide range of courses for further details visit : http://www.rit.ac.in/courses.php.
information about fee,For Fee detail visit :http://www.rit.ac.in/
where is the college located,Nedumkuzhy, Velloor, Pampady, Kerala 686501 Rajiv Gandhi Institute Of Technology, address
hostel,RIT has two ladies hostels and one men's hostel with an intake of 280 and 107, respectively. Apart from this, RIT runs a separate P.G. hostel in the campus. Procedure for hostel admission is as per the institute norms
events organised,Our events are : http://www.rit.ac.in/rit-activities.php
size of campus,My College has many floors 
Syllabus for IT,Timetable provide direct to the students
is there any library,There is one huge and spacious library.timings are 8am to 6pm and for more visit
how is college infrastructure,Our University has Excellent Infrastructure. Campus is clean. Good IT Labs With Good Speed of Internet connection
food facilities,Our university has canteen with variety of food available
food menu,In the mess we serve Franky, Locho, Alu-puri, Kachori, Khavsa, Thaali and many more on menu
What is college placement,To know about placement visit <a target=\"_blank\" href=\"PLACEMENT INFORMATION LINK FROM YOUR UNIVERSITY WEBSITE IF THEY HAVE\">here</a>
Who is HOD,All engineering departments have only one hod XYZ who available on (Place name)
Who is computer HOD,All engineering departments have only one hod XYZ who available on (PLACE NAME)